{
  "review_version": "aau-reproduction-review/0.1",
  "reviewer_commitment_sha256": "cccccccccccccccccccccccccccccccccccccccccccccccccccccccccccccccc",
  "relationship_to_issuer": "same_organization",
  "relationship_to_producer": "same_organization",
  "reviewed_on": "2026-08-29",
  "checks": {
    "role_separation_reviewed": true,
    "relationship_evidence_reviewed": true,
    "challenge_blinding_reviewed": true,
    "transcript_review_completed": true
  },
  "limitations": [
    "All three roles are simulated inside the maintainer reference workflow, so this pack demonstrates the protocol and is not independent evidence.",
    "The committed oracle is revealed training material and must not be reused as a live blind challenge."
  ]
}
